{"authority_tiers":[{"mathematical_authority":false,"meaning":"The surface transports, parses, serializes, hashes, schedules, or computes without establishing a mathematical verdict.","requirements":["No success state may be promoted to proof, refutation, exactness, or external verification.","Outputs remain data or diagnostics until an explicitly stronger boundary checks them."],"tier_id":"none"},{"mathematical_authority":false,"meaning":"A producer reports a candidate, witness, derivation, numerical result, or backend outcome that still requires an independent boundary.","requirements":["Exact producer identity, configuration, inputs, budget, and output bytes are retained.","Producer completion never self-attests mathematical truth."],"tier_id":"producer_report"},{"mathematical_authority":true,"meaning":"A pinned solver or CAS establishes a verdict under its own implementation and runtime trust assumptions without an independent replay artifact.","requirements":["Backend, version range, inputs, limits, and unsupported states remain explicit.","The result is never relabeled as an independent certificate or proof-assistant check."],"tier_id":"solver_verdict"},{"mathematical_authority":true,"meaning":"A distinct dependency-minimal checker replays exact evidence under a small declared Python and arithmetic trust base.","requirements":["Checker and producer identities are distinct and all evidence bytes are content-addressed.","Malformed, unsupported, exhausted, disagreement, and replay-mismatch states fail closed."],"tier_id":"checker_attestation"},{"mathematical_authority":true,"meaning":"A separately pinned proof-assistant kernel accepts an exact exported theorem and replay artifact.","requirements":["Export alone remains pending and carries no proof-assistant authority.","Toolchain identity, source theorem bytes, generated proof bytes, and successful replay are bound."],"tier_id":"external_proof_assistant"}],"contract":{"contract_id":"MH-C-TRUST-BASE-001","path":"docs/contracts/MH-C-TRUST-BASE-001.json","schema_sha256":"99c3024ffc5f2de636d2a61ed9c01a9396aa51c1f54b09fe14e6dde7d6816f3d","sha256":"2d2c23da4d3b167c5220c7548602f11403af7634031c438a8f61ac8e3e191456"},"entry_points":[{"entry_id":"checker.certificate","kind":"public_checker","surface_ids":["arithmetic.exact","arithmetic.mixed-math","parser.python-ast","runtime.clock","runtime.python"],"target":"mathhead.certificate:check_certificate"},{"entry_id":"checker.discovery-rup","kind":"public_checker","surface_ids":["checker.discovery-rup","hashing.sha256","runtime.python","serialization.legacy-json"],"target":"mathhead.discovery.rup_check:check_drup_proof"},{"entry_id":"checker.provenance-replay","kind":"public_checker","surface_ids":["hashing.sha256","runtime.python","serialization.legacy-json"],"target":"mathhead.kernel.provenance:replay_provenance_bundle"},{"entry_id":"checker.sat-replay","kind":"public_checker","surface_ids":["checker.discovery-rup","checker.drup","hashing.sha256","runtime.python","serialization.legacy-json"],"target":"mathhead.kernel.sat:check_sat_certificate"},{"entry_id":"checker.unsat","kind":"public_checker","surface_ids":["checker.drup","hashing.sha256","runtime.clock","runtime.python","serialization.legacy-json"],"target":"mathhead.drat:check_unsat_proof"},{"entry_id":"console.mathhead","kind":"console_script","surface_ids":["parser.python-ast","serialization.legacy-json","solver.pysat","solver.sympy","solver.z3","transport.cli"],"target":"mathhead.cli:main"},{"entry_id":"console.mathhead-discover","kind":"console_script","surface_ids":["checker.discovery-kernel","process.external-nauty","serialization.legacy-json","solver.pysat","solver.sympy","transport.cli"],"target":"mathhead.discovery.cli:main"},{"entry_id":"console.mathhead-server","kind":"console_script","surface_ids":["process.subprocess","solver.pysat","solver.sympy","solver.z3","transport.mcp"],"target":"mathhead.server.mcp_server:main"},{"entry_id":"kernel.discovery","kind":"proof_kernel","surface_ids":["arithmetic.exact","checker.discovery-kernel","runtime.python"],"target":"mathhead.discovery.kernel:check"},{"entry_id":"kernel.mathhead","kind":"proof_kernel","surface_ids":["arithmetic.exact","checker.stdlib-certificate","hashing.sha256","runtime.python","serialization.legacy-json"],"target":"mathhead.kernel.checkers:check_proof_term"},{"entry_id":"proof-assistant.lean","kind":"public_checker","surface_ids":["arithmetic.exact","checker.stdlib-certificate","hashing.sha256","process.filesystem","process.subprocess","proof-assistant.lean","runtime.python","serialization.legacy-json"],"target":"mathhead.proof_assistant.lean:verify_with_lean"},{"entry_id":"proof-assistant.lean-provenance","kind":"public_checker","surface_ids":["arithmetic.exact","checker.discovery-rup","checker.drup","checker.stdlib-certificate","hashing.sha256","process.filesystem","process.subprocess","proof-assistant.lean","runtime.python","serialization.legacy-json"],"target":"mathhead.proof_assistant.provenance:replay_lean_provenance"}],"foundation":{"bundle_sha256":"4132b29b69600f8ff48477515853f66bb748c7337735c00db8e634987f70ddca","manifest_path":"docs/fixtures/foundation-v1/manifest.json","manifest_sha256":"c2d1ba4ed240b46f64d1f67fb75a74240b23886561175c0e37310004ab3a86f3"},"import_roots":[{"kind":"language","policy":"required","reason":"Postponed annotation semantics are part of the Python source contract.","root":"__future__","surface_id":"runtime.python"},{"kind":"stdlib","policy":"required","reason":"Console argument decoding is a transport boundary.","root":"argparse","surface_id":"transport.cli"},{"kind":"stdlib","policy":"required","reason":"Expression and formula text is parsed through the CPython AST representation.","root":"ast","surface_id":"parser.python-ast"},{"kind":"stdlib","policy":"required","reason":"Console output encoding fallback is transport-only.","root":"codecs","surface_id":"transport.cli"},{"kind":"stdlib","policy":"required","reason":"Standard deterministic containers are runtime support.","root":"collections","surface_id":"runtime.python"},{"kind":"stdlib","policy":"required","reason":"Object copying is a runtime support primitive.","root":"copy","surface_id":"runtime.python"},{"kind":"stdlib","policy":"effect_only","reason":"Windows Job Object creation, limits, accounting, and handle cleanup cross the process boundary.","root":"ctypes","surface_id":"process.subprocess"},{"kind":"stdlib","policy":"required","reason":"Current immutable and result structures rely on CPython dataclasses.","root":"dataclasses","surface_id":"runtime.python"},{"kind":"stdlib","policy":"effect_only","reason":"Process cleanup classifies operating-system errors without authority.","root":"errno","surface_id":"process.subprocess"},{"kind":"stdlib","policy":"required","reason":"Fraction supplies exact rational arithmetic to current checkers.","root":"fractions","surface_id":"arithmetic.exact"},{"kind":"stdlib","policy":"required","reason":"Decorators, reduction, and caching helpers are runtime support.","root":"functools","surface_id":"runtime.python"},{"kind":"stdlib","policy":"required","reason":"SHA-256 content identities bind artifacts and replay inputs.","root":"hashlib","surface_id":"hashing.sha256"},{"kind":"stdlib","policy":"required","reason":"Priority queues are runtime support and grant no authority.","root":"heapq","surface_id":"runtime.python"},{"kind":"stdlib","policy":"effect_only","reason":"Discovery registries dynamically load strategies and proof renderers.","root":"importlib","surface_id":"process.dynamic-import"},{"kind":"stdlib","policy":"required","reason":"Finite combinatorial iteration is standard runtime support.","root":"itertools","surface_id":"runtime.python"},{"kind":"stdlib","policy":"required","reason":"Legacy CLI, cache, instrumentation, and discovery identities use JSON.","root":"json","surface_id":"serialization.legacy-json"},{"kind":"stdlib","policy":"required","reason":"The current surface mixes exact integer helpers with floating-point transcendental functions.","root":"math","surface_id":"arithmetic.mixed-math"},{"kind":"third_party","policy":"effect_only","reason":"FastMCP is an external request and response transport and has no mathematical authority.","root":"mcp","surface_id":"transport.mcp"},{"kind":"third_party","policy":"producer_only","reason":"Numerical and interval computations are precision-bounded producer evidence.","root":"mpmath","surface_id":"arithmetic.approximate"},{"kind":"stdlib","policy":"effect_only","reason":"Parallel search and SAT workers are effect boundaries.","root":"multiprocessing","surface_id":"process.workers"},{"kind":"stdlib","policy":"effect_only","reason":"MCP profile selection reads an environment value at the transport boundary.","root":"os","surface_id":"transport.mcp"},{"kind":"stdlib","policy":"effect_only","reason":"Discovery exports, instrumentation, and caches read or write local paths.","root":"pathlib","surface_id":"process.filesystem"},{"kind":"third_party","policy":"producer_only","reason":"PySAT backends produce SAT witnesses or proof traces that require independent checking.","root":"pysat","surface_id":"solver.pysat"},{"kind":"stdlib","policy":"effect_only","reason":"Discovery generation uses pseudorandom choices that must never enter checker replay.","root":"random","surface_id":"runtime.nondeterminism"},{"kind":"stdlib","policy":"required","reason":"Regular-expression matching supports syntax and registry mechanics.","root":"re","surface_id":"runtime.python"},{"kind":"stdlib","policy":"effect_only","reason":"POSIX worker CPU, address-space, file-size, and descriptor ceilings cross the process boundary.","root":"resource","surface_id":"process.subprocess"},{"kind":"stdlib","policy":"effect_only","reason":"Executable discovery and filesystem operations are external effects.","root":"shutil","surface_id":"process.filesystem"},{"kind":"stdlib","policy":"effect_only","reason":"POSIX process-group termination uses ex